{
  "status": "draft",
  "evidence_tier": "E2",
  "reviewers": [],
  "system": "CT",
  "drawn_in_3d": true,
  "sources": [
    "S9",
    "S23",
    "S24"
  ],
  "revision": {
    "rev": "A",
    "author": "AI draft",
    "date": "2026-09-29",
    "note": "Drop 5 seed"
  },
  "hazards": [
    {
      "class": "Stored pressure",
      "control": "Pressure test before opening to the well; bleed down and verify zero before breaking any connection."
    },
    {
      "class": "Line of fire",
      "control": "Stay clear of the coil path, the gooseneck, and flowback iron under flow."
    }
  ],
  "id": "CT-STACK-MOTOR",
  "parent": "CT-STACK-INJECTOR",
  "group": "injector",
  "level": "component",
  "name": "Hydraulic drive motors",
  "aliases": [
    "injector motors",
    "drive motors"
  ],
  "function": "The hydraulic motors on the injector frame that turn the drive chains, with a brake that holds the coil when the motors stop.",
  "tabs": {
    "overview": "Speed and torque set by the power pack flow and pressure; the brake holds against the snub or pull load when stopped.",
    "engineering": "Two or four motors per injector.",
    "safety": "Brake function tested before running; hot hydraulic lines.",
    "evidence": "Public coiled tubing pressure control guide (S24), API RP 16ST and API RP 5C7 scope (S23, S26), field practice (S9)."
  },
  "glb": "/glb/CT/CT-STACK.glb",
  "mesh_nodes": [
    "CT-STACK-MOTOR"
  ]
}
