{
  "status": "draft",
  "evidence_tier": "E2",
  "reviewers": [],
  "system": "SC",
  "drawn_in_3d": true,
  "sources": [
    "S42",
    "S9"
  ],
  "revision": {
    "rev": "A",
    "author": "AI draft",
    "date": "2026-09-29",
    "note": "Drop 8 seed"
  },
  "hazards": [
    {
      "class": "Stored pressure",
      "control": "Bleed the tubing and casing to zero and verify before breaking any connection."
    }
  ],
  "id": "SC-GRAVELPACK-GPPACKER",
  "parent": "SC-GRAVELPACK",
  "group": "gravel-pack",
  "level": "component",
  "name": "Gravel pack packer",
  "aliases": [
    "GP packer",
    "gravel pack packer",
    "top packer"
  ],
  "function": "The packer above the interval that carries the screen assembly, seals the annulus, and receives the completion seal assembly afterwards.",
  "tabs": {
    "overview": "Set hydraulically from the service tool; its bore takes the crossover during the pack and the production seals after.",
    "engineering": "Rated for the pack pressure and the production differential.",
    "safety": "Set and tested before the pack is pumped.",
    "evidence": "PetroWiki sand control techniques (S42), ISO 17824 for screens (S47), API RP 19C for gravel testing (S12 if held), field practice (S9). Generic geometry; not an OEM design."
  },
  "glb": "/glb/SC/SC-GRAVELPACK.glb",
  "mesh_nodes": [
    "SC-GRAVELPACK-GPPACKER"
  ]
}
