{
  "status": "draft",
  "evidence_tier": "E2",
  "reviewers": [],
  "system": "DT",
  "drawn_in_3d": true,
  "sources": [
    "S9",
    "S20",
    "S21"
  ],
  "revision": {
    "rev": "A",
    "author": "AI draft",
    "date": "2026-09-29",
    "note": "Drop 4 seed"
  },
  "hazards": [
    {
      "class": "Stored pressure",
      "control": "Pressure test before pumping; bleed down and verify zero before breaking any connection."
    }
  ],
  "id": "DT-SETTINGTOOL-SHEAR",
  "parent": "DT-SETTINGTOOL",
  "group": "plug-and-perf",
  "level": "component",
  "name": "Shear ring",
  "aliases": [
    "shear ring",
    "shear stud",
    "release"
  ],
  "function": "The calibrated ring or stud that parts at the design load once the plug is fully set, releasing the tool from the plug.",
  "tabs": {
    "overview": "Shear value is set above the setting load and below the tool capacity.",
    "engineering": "Replaced each run.",
    "safety": "A wrong value leaves the tool attached or shears early.",
    "evidence": "Public plug-and-perf explainer (S20), API Spec 11D1 scope (S21), field practice (S9). Dimensions are public example values, not a manufacturer's design."
  },
  "glb": "/glb/DT/DT-PLUGSET.glb",
  "mesh_nodes": [
    "DT-SETTINGTOOL-SHEAR"
  ]
}
