{
  "status": "draft",
  "evidence_tier": "E2",
  "reviewers": [],
  "system": "SC",
  "drawn_in_3d": true,
  "sources": [
    "S42",
    "S47"
  ],
  "revision": {
    "rev": "A",
    "author": "AI draft",
    "date": "2026-09-29",
    "note": "Drop 8 seed"
  },
  "hazards": [
    {
      "class": "Stored pressure",
      "control": "Bleed the tubing and casing to zero and verify before breaking any connection."
    }
  ],
  "id": "SC-GRAVELPACK-SCREEN",
  "parent": "SC-GRAVELPACK",
  "group": "gravel-pack",
  "level": "component",
  "name": "Wire-wrapped screen",
  "aliases": [
    "screen",
    "wire-wrapped screen",
    "WWS",
    "premium screen",
    "mesh screen"
  ],
  "function": "The keystone wire wrap on ribs over the base pipe whose slot holds the gravel while letting fluid through.",
  "tabs": {
    "overview": "Slot sized below the smallest gravel; premium mesh screens use woven layers for finer sand; designed and tested to ISO 17824.",
    "engineering": "ISO 17824.",
    "safety": "Handled with protectors; erosion at high rates or with a void in the pack.",
    "evidence": "PetroWiki sand control techniques (S42), ISO 17824 for screens (S47), API RP 19C for gravel testing (S12 if held), field practice (S9). Generic geometry; not an OEM design."
  },
  "glb": "/glb/SC/SC-GRAVELPACK.glb",
  "mesh_nodes": [
    "SC-GRAVELPACK-SCREEN"
  ],
  "standards": [
    {
      "standard": "ISO 17824",
      "edition": "verify",
      "paraphrase": "Sand screens.",
      "source": "S47"
    }
  ]
}
